{
  "schema_version": "1.0",
  "kind": "career-interview-result",
  "result_id": "result-synthetic",
  "created_at": "2026-10-09T12:30:00Z",
  "handoff_ref": {
    "id": "handoff-synthetic",
    "sha256": "0000000000000000000000000000000000000000000000000000000000000000"
  },
  "answers": [
    {
      "id": "answer-1",
      "text": "동료 의견을 받아 체크리스트 순서를 수정했습니다.",
      "source_kind": "user_answer"
    }
  ],
  "feedback": [
    {
      "answer_id": "answer-1",
      "text": "직접 한 수정과 동료 기여를 구분해 설명하세요.",
      "source_kind": "model_feedback"
    }
  ],
  "candidates": [
    {
      "id": "candidate-1",
      "text": "동료 의견을 받아 체크리스트 순서 수정",
      "answer_id": "answer-1",
      "status": "pending"
    }
  ]
}
